company_name,website_url,label_relevance,scraped_text
Stanley Steemer,https://www.stanleysteemer.com,0,"Professional Cleaning Services for Home & Business | Stanley Steemer 1-800-STEEMER® | Call for a free quote Residential Commercial close ⚠ Confirm Changing locations will reset your order. Continue? Ok close Forgot your password? Enter your email address to get instructions on how to retrieve your password. Email Address Forgot Email Oops! You must complete the highlighted email field above with a valid email address. Send close This email address is not a registered user. Please try again. Forgot password? Enter your email address to get instructions on how to retrieve your password. Email Address Oops! You must complete the highlighted email field above with a valid email address. Send Invalid email address or password. If you have forgotten your password, please use the ""Forgot your password?"" option Ok close Forgot password Thank You. An email has been sent to the address you entered with instructions for resetting your password. If you don’t receive this email shortly, please check your junk or spam folder. Stanley Steemer provides professional deep cleaning services and comprehensive care for a cleaner, healthier home and business Calculate your instant, no-strings-attached quote For Home For Business More Than Just Carpet Cleaning Stanley Steemer gets carpet cleaner—AND everything else! From your floors to your furniture, air ducts, and more, we provide whole-home and business cleaning. No matter where dirt, dust, and contaminants may settle, we can clean it. Carpet Air Duct Upholstery Tile & Grout Area Rug Hardwood Natural Stone Car, Boat & RV Water Damage Carpet Cleaning Our equipment and carpet cleaners remove an average of 94% of common household allergens . Learn more about Carpet Cleaning Air Duct Cleaning Our professional air duct cleaning service can improve the air quality throughout your home and make your system more energy efficient. Learn more about Air Duct Cleaning Upholstery Cleaning Our upholstery cleaning service uses the same proprietary cleaning process that we’ve used to clean carpet for more than seven decades. Learn more about Upholstery Cleaning Tile & Grout Cleaning Our professional tile and grout cleaning service uses our proprietary cleaning method to clean dirt and restore luster to your tile floors. Learn more about Tile & Grout Cleaning Area Rug Cleaning We remove dirt and allergens from deep within the fibers of your rug with a gentle touch that won’t damage these decorative floor coverings. Learn more about Area Rug Cleaning Hardwood Floor Cleaning We use our patented hardwood floor auto scrubber in our hardwood floor cleaning service to give your floors the best clean possible. Learn more about Hardwood Floor Cleaning Natural Stone Cleaning Let us help you protect your investment. We use a delicate touch to clean and preserve stone floors so they look better and last longer. Learn more about Natural Stone Cleaning Car, Boat & RV Cleaning We built our reputation on carpet cleaning, but we also apply our clea Carpet Cleaning | Stanley Steemer 1-800-STEEMER® | Call for a free quote Residential Commercial close ⚠ Confirm Changing locations will reset your order. Continue? Ok close Forgot your password? Enter your email address to get instructions on how to retrieve your password. Email Address Forgot Email Oops! You must complete the highlighted email field above with a valid email address. Send close This email address is not a registered user. Please try again. Forgot password? Enter your email address to get instructions on how to retrieve your password. Email Address Oops! You must complete the highlighted email field above with a valid email address. Send Invalid email address or password. If you have forgotten your password, please use the ""Forgot your password?"" option Ok close Forgot password Thank You. An email has been sent to the address you entered with instructions for resetting your password. If you don’t receive this email shortly, please check your junk or spam folder. carpet cleaning Carpet Cleaning For 75 years, Stanley Steemer has been the professional carpet cleaning expert people trust to deliver the best carpet cleaning service available. Stanley Steemer's carpet cleaning removes an average of 94% of common household allergens . Even our carpet cleaning solution is made without harsh chemicals to make it safe for you, your pets and, the environment. In other words, a carpet cleaning from Stanley Steemer will leave your home cleaner and healthier. Our carpet cleaning service uses a proprietary hot water extraction cleaning method. This is often called ""steam carpet cleaning,"" although we do not actually use steam to clean. This cleaning method allows us to safely remove dirt, spots and odors, without leaving behind any residue. So when you need a professional carpet cleaning, contact Stanley Steemer, the carpet cleaner near you. Find a carpet cleaner near you here . Get Closer to a Cleaner Carpet with an instant quote and online scheduling Zip Code Please provide a valid zip code. Why Stanley Steemer Tough on Dirt. Gentle on Carpet. ® Advanced Pre-Spray Breaks Down Soiling To start our process, we apply a pre-spray treatment that helps safely remove stubborn spots and spills. With our advanced formula, it also cleans better, smells fresher, and dries faster. Remove Embedded Dirt, Allergens , & More We extract dirt, soiling & allergens with solutions that have gentle ingredients. This means we leave behind no harmful residue so it's safer for family & pets. We’re even data-backed to remove on average 94% of common household allergens from carpet. Powerful Results with Our Proprietary Equipment We clean using proprietary cleaning equipment engineered at our own facilities. With continuous innovation, we achieve high quality control & deliver the best results possible for your carpet. Carpet Protector Extend the Life of Your Carpet Cleaning To extend the life of your carpet cleaning, we can apply a protector that aids in the prevention Air Duct Cleaning | Stanley Steemer 1-800-STEEMER® | Call for a free quote Residential Commercial close ⚠ Confirm Changing locations will reset your order. Continue? Ok close Forgot your password? Enter your email address to get instructions on how to retrieve your password. Email Address Forgot Email Oops! You must complete the highlighted email field above with a valid email address. Send close This email address is not a registered user. Please try again. Forgot password? Enter your email address to get instructions on how to retrieve your password. Email Address Oops! You must complete the highlighted email field above with a valid email address. Send Invalid email address or password. If you have forgotten your password, please use the ""Forgot your password?"" option Ok close Forgot password Thank You. An email has been sent to the address you entered with instructions for resetting your password. If you don’t receive this email shortly, please check your junk or spam folder. Air Duct Cleaning Air Duct Cleaning Air duct cleaning redefines home health. Eliminating dirt, dust and microbial growth from your ductwork can improve indoor air quality while maintaining a cleaner home and increasing HVAC efficiency. Clean ducts mean less dirt in your home and air because ductwork is often the source and pathway for dust and biological contaminants. There can be pounds of dirt hiding in your air ducts. Buildup from daily HVAC use, pet dander, new construction or remodeling, smoking and water damage can add millions of dirt, dust and debris particles in your ductwork. Together with our proprietary equipment and professionally trained technicians, Stanley Steemer delivers a whole-system clean unlike any other. Don’t wait for cleaner indoor air. Schedule your inspection today and start breathing cleaner air. Find an air duct cleaning service near you here. Find Air Duct Cleaner Find Air Duct Cleaning Near You Call 1-800-STEEMER ® or enter your zip code to check availability. Zip Code Please provide a valid zip code. Why Stanley Steemer Air Duct Cleaning Process EXPERT CARE FOR YOUR AIR ® Air Duct Inspection We offer air duct inspections to verify that your air ducts need to be cleaned, provide education and let you know what you can expect. Depending on your local Stanley Steemer , the inspection and cleaning may be separate appointments. Vacuuming Using a powerful HEPA-filtered vacuum, we clean your furnace evaporator coil, blower and vent covers. Then we connect it to your ductwork to pull dirt from deep inside the system. Compressed Air Flush After loosening the contaminants lodged in your air ducts, we blow compressed air through the system to flush all traces of dirt and dust out of your ductwork and into our specialized vacuum system. Dryer Vent Cleaning Fire Safety Hazard Failure to clean and maintain dryers is the leading cause of residential dryer fires in the United States. Protect your home with regular dryer vent cleaning. Annual Dryer Vent Ma"
Orkin,https://www.orkin.com,0,"Orkin Termite Treatment, Pest Control & Exterminator Service | Orkin Skip to Content GET A QUOTE The Orkin Pros. The best in Pests.™ Get a personalized quote today. Call 877-819-5061 Find Pest Control Near Me Orkin Pros are experts in your local pests because they live and work where you do. Call 877-819-5061 or search based on your ZIP code for an exterminator near you. ENTER YOUR ZIP CODE Save $50 on Pest Control and Prevention Have a pest problem? Save $50 on your first recurring service today with code 50OFF. Get a Free Quote OUR SERVICES Specialized Prevention and Targeted Plan of Attack Over a century of experience solving pest problems. Our service combines the most advanced technology and methods available today. This means your customized plan is designed to get pests out of your home and keep them out year-round. Pest Problem? We can help. Targeted Pest Control Laser-focused pest treatments using industry-leading technology rid your home of pests quickly and effectively. Get Pest Control Seasonal Pest Protection Mosquito Control Take back your yard. Orkin’s seasonal mosquito control service targets where mosquitoes breed around your home. Get Mosquito Control Keep Your Home Pest Free All Year-Round Preventative Pest Control Our proactive prevention services keeps your home safe from invasion across all seasons and all homes. Get Pest Prevention Spotted tubing? We can help. Termite Control Tailored to fit the unique needs of your home, our safe and comprehensive termite treatments stop pests. Get Termite Control Orkin Home Services Full Property Protection Protect your home inside and out. Our Orkin home improvement services include full-property coverage that helps prevent pest infestations and common homeowner issues. Find Home Services The Orkin Guarantee We're not happy, until you're happy. With off-schedule return visits and a 30-day money back guarantee , keeping your home safe and giving you peace of mind is what we do best. IDENTIFY AND PROTECT Orkin Begins With Science Browse Full Pest Library Get a quote today Eliminate pests and prevent future problems. We are here for you 24 hours a day, 7 days a week. 877-819-5061 Seasonal Pest Control | Pest Protection All Year Long | Orkin Skip to Content GET A QUOTE SEASONS OF PEST PROTECTION While a year has four seasons for people, we believe there are six seasons for pests. When is the best time of year for pest control? Pests are present all year long no matter the weather, season, or area you live. The best time of year for pest control is all year long to help keep them at bay and prevent future infestations. We approach pest control based on pests’ habits – what pests are doing and where they are going during each time of the year. Additionally, we used Climate Zones defined by the US Department of Energy as a foundation to identify 9 distinct pest zones in the US that all have unique pest control needs. Each Orkin Pro visit features special activities and treatments to ensure that your home is protected from pest behaviors specific to both the pest season and the zone. Get peace of mind today and call Orkin for a free personalized quote . Learn more about seasonal pest control for your city on your local Orkin branch page. When are bugs most active? When are bugs most active? Swarm Season (Spring) As temperatures rise in early spring, pests become more active, emerging from their winter hiding spots to search for food and suitable nesting sites. Insects like termites and ants begin their swarming phase, looking to establish new colonies, while rodents and other pests start scouting for ideal environments to thrive. During this season, our exterminators will take proactive measures to deter infestations before they get out of hand. Breeding Season (Late Spring – Early Summer) With summer approaching, many pests shift their focus to reproduction, rapidly increasing their populations. Mosquitoes lay their eggs in standing water, flies become more prevalent, and cockroach activity surges in warm, humid conditions. Our services target these growing pest populations, preventing infestations before they escalate. High Season (Mid – Late Summer) Summer is peak pest season, with increased activity from mosquitoes , ants, wasps , and other warm-weather pests. Just as people spend more time outdoors, so do pests, which can lead to more frequent encounters and infestations. Our exterminators will take extra precautions to protect your home from the season’s most persistent pests, ensuring they don’t disrupt your summer. Prep Season (Early Fall) As temperatures start to cool, many pests begin preparing for winter by seeking shelter in homes and other structures. This is an ideal time to reinforce pest protection, sealing entry points, and reducing attractants before winter pests settle in. Our services focus on safeguarding your home ahead of their seasonal migration indoors. Invader Season (Late Fall – Early Winter) With cold weather setting in, pests like rodents, cockroaches , and spiders look for warmth and food inside homes. Small cracks, vents, and openings become prime entry points for these invaders. We’ll ensure you Orkin Home Services | Home Improvements and Repairs | Orkin Skip to Content GET A QUOTE HOME SERVICES In addition to helping prevent termites, bed bugs, and other pests from attacking your home, Orkin can provide home services against problems such as moisture. We even offer services and products that can help you run a more energy-efficient household. More Than Just Pest Control Protection From the Curb to the Attic Orkin home improvement services include full-property coverage that helps prevent pest infestations and common homeowner issues. From attic insulation to gutter services to moisture control, Orkin helps create a safe, energy efficient and bug-free home. OrkinShield Pest prevention is the best pest control. Protect your home from mice, rats and other wildlife with OrkinShield, sealing and blocking entry points along the foundation. Attic Insulation OrkinTherm® and Orkin ComfortZone® insulation for attics, crawlspaces, and basements not only insulate — but provide extra defense against pests. Leaf Stopper Orkin Leaf Stopper® helps put an end to gutter cleaning, prevents pests, and helps prevent water damage. Plus, it doesn’t dent, break, or rust. Moisture Control Orkin DryZone® is a customized and effective program that targets moisture by reducing humidity. It helps protect pipes and can increase energy efficiency. Wildlife Management Furry neighbors getting too cozy? Orkin’s Wildlife Management service can help customers control wildlife such as squirrels, opossums, and raccoons. VitalClean Orkin® VitalClean™ will kill 100% of bacteria and viruses on hard, non-porous surfaces and will also sanitize soft, porous surfaces. Find Orkin Home Services Near Me Orkin Pros are experts in your local pests because they live and work where you do. Call 877-819-5061 or search based on your ZIP code for an exterminator near you. ENTER YOUR ZIP CODE Homeowner Pest Prevention for Homebuyers and Homeowners Did you know many home insurance policies don’t cover pest damage? Whether you’ve had your home for years or are on the market for a new one, a thorough inspection is essential for pest prevention and pest control. Know the signs a pest may be present and how to keep them out. New Homeowner Pest Prevention Need Pest Control Now? Need Pest Control Now? Termite Extermination Don’t ignore a termite infestation. Getting rid of termites requires professional solutions and the damage only increases if you wait. If you suspect termites in your home, contact Orkin. Free Termite Inspection Mosquito Control Protect your outdoor space and your home from these irritating and potentially dangerous pests. Orkin uses the latest technologies to help you take back your space. Get a Free Mosquito Quote Common Household Pests Your local Orkin Pros specialize in understanding and defeating the most common pests in your area. Contact us for a free quote and a plan tailored to your specific pest problem. Orkin Pest Control Load More Seasons of Pest Protection Home Pest "
Roto-Rooter,https://www.rotorooter.com,0,"Roto-Rooter® | Plumbing, Drains & Water Cleanup Get the Roto-Rooter App Download Skip to main content Location Find your local plumber Schedule Call 800-768-6911 The Plumbing Experts You've Trusted for Over 90 Years Call Us Now! 800-768-6911 Find Your Local Plumber Enter ZIP, City or Postal Code Fast, Friendly and Professional Service. Schedule Now! OUR SERVICES Emergency Plumbing Services Our plumbers are ready to go 24/7 for emergencies - including nights, weekends and holidays. EXPLORE THIS SERVICE Plumbing and Drains As the largest plumbing and drain service company, we make thousands of repairs every day. EXPLORE THIS SERVICE Water Damage Our teams are equipped with state-of-the-art water extraction and cleanup equipment. EXPLORE THIS SERVICE Water Heaters Trust Roto-Rooter for repair and replacement of gas, electric and tankless water heaters. EXPLORE THIS SERVICE LEAVE PLUMBING TO THE PROS BECAUSE WITH ROTO-ROOTER, YOU GET MORE THAN A GUARANTEE. REPUTATION Highly-trained professionals since 1935. A job done right by the original experts. QUALITY Full-service drain cleaning – using state-of-the-art diagnostics and equipment. TRANSPARENCY Free onsite estimates. No hidden or extra charges for plumbing or drain service on holidays, nights, and weekends. EFFICIENCY Same-day and emergency service 365 days a year. QUALITY Full-service plumbing, drain cleaning, and water cleanup – using state-of-the-art diagnostics and equipment. FINANCING Get it fixed today and take time to pay. Special financing options available. YOU HAVE QUESTIONS, WE HAVE ANSWERS. Read our most frequently asked questions for your plumbing needs, or watch our latest videos Read Our Faqs Watch. Learn. Fix. Download our Mobile App! Do You Need a Battery Backup Sump Pump? Roto-Rooter | We Do Both Sequel What To Expect When You Schedule Roto-Rooter Service Explore Videos Loading customer reviews... THE BUCK$ START HERE. Plumbers Wanted! CAREER OPPORTUNITIES Roto-Rooter Plumbing & Water Cleanup | Schedule Your Appointment Get the Roto-Rooter App Download Skip to main content Location Find your local plumber Call 800-768-6911 Schedule Service Please enter Zip or Postal Code below, or call 800-768-6911 . Find Your Local Plumber What To Expect When You Schedule Roto-Rooter Service Get the Roto-Rooter App Download Skip to main content Location Find your local plumber Schedule Call 800-768-6911 Home Plumbing Videos Plumbing What To Expect When You Schedule Roto-rooter Service Search Plumbing What To Expect When You Schedule Roto-Rooter Service Know exactly what to expect when you schedule plumbing service from Roto-Rooter. Our video demonstrates how a service call typically goes from your initial call for help until our technician completes repairs. We will keep you informed about arrival times, so you can go about your day until it’s almost time for service. There’s no need to skip work or cancel plans because Roto-Rooter will give you at least 30 minutes of advance notice before we arrive. Once at your home, we’ll assess the issue and provide a written cost estimate without surprises or unexpected add on fees . Roto-Rooter makes the service experience transparent, giving you the information you need to make budget-friendly decision. You can trust Roto-Rooter to resolve your plumbing issues hassle-free. VIEW TRANSCRIPT ♪ Music ♪ If you're seeing me now it's because you're dealing with a plumbing problem and probably a good bit of stress too. Well, we appreciate you calling Roto-Rooter and rest assured, we've got this! Now that you've scheduled your service visit, here's what you can expect next. For starters, we know your time is valuable so we'll call or text before our expected arrival time. That way if there are unexpected service delays, you can go about your day until it's almost time for your service visit. All we ask is that when we do call, you answer. Simple as that. A uniformed and security-badged service tech will always show up on a branded Roto-Rooter vehicle. Also, our technician will put on boot covers before coming into your home. We'll professionally assess the situation and give you an upfront, written cost estimate. If there's more than one possible solution, we'll let you know so you can make the most informed choice for your budget and your home. If you accept, we'll begin to work right away, and of course, we'll guarantee the job. Thanks again for choosing Roto-Rooter... and leaving Plumbing to the pros. ♪ ♪ ♪ Related Videos How to Quiet Creaky Pipes Pipes Drains Draining Slowly? Drains How to Get Rid of Sink Stink | Method 2 Sinks How to Get Rid of Sink Stink | Method 1 Sinks How to Remove and Prevent Floor Drain Odors Drains How to Get Rid of Sink Stink | Method 3 Sinks How to Recognize the Different Kinds of Pipes in Your House Pipes How to Get Rid of Drain Flies Sinks How to Shut-Off Your Water Flooding Test Your Water Heater's Temperature and Pressure Relief Valve Water Heaters Tips On Maintaining A Sump Pump Sump Pumps Finding and Repairing Plumbing Leaks | Roto-Rooter Water Damage Restoration 3 Things You Need to Know About Rain Showerheads Plumbing Roto-Rooter | We Do Both Sequel Water Damage Restoration Water Damage Cleanup Service Water Dam"
