company_name,website_url,label_relevance,scraped_text
CFO Advisors,https://www.cfoadvisors.com,0,"CFO Advisors | Operational Excellence Most finance functions create operational tax We help companies create operational excellence Transparency Do we understand what happened and why? Actual ARR vs Board Plan Actual ARR vs Board Plan Our product suite delivers custom dashboards for Revenue, Headcount, Expenses, and other Key KPIs directly through Slack, ensuring executives have real-time clarity . Alignment Are the board, management, and employees aligned on the key bets & critical few metrics? Strategic Focus Ensure board, management, and team alignment on strategic priorities and the critical metrics that matter most. Accountability Does strategy, prioritization, or resourcing change when you beat or miss targets? CFO Advisors APP 6:00 AM 📊 Live Pied Piper AI Departmental Budget Data as of 2025-04-14 01:02:58 View Full Dashboard Departmental Budget Summary (42 KB) ▼ 💡 Notable Expenses over the last 7 Days 💡 Date Amount Vendor Department Account ---------- --------- -------------------------- ----------------------- ----------------- 2025-04-07 $ 10,050 ICE Mortgage Techno General & Administrative Rev Share 2025-04-09 $ 8,625 Depth Public Relati Marketing Professional Fees 2025-04-12 $ 6,527 UAB Proprietas General & Administrative Facilities 2025-04-11 $ 5,000 The Mortgage Collab Marketing Advertising 2025-04-11 $ 3,294 Amazon Research & Development Professional Fees 2025-04-10 $ 7,110 CloudFlare Services Infrastructure Cloud Services 2025-04-08 $ 4,500 Stripe Payments Sales Payment Processing Performance Driven Our product suite delivers custom dashboards for Revenue, Headcount, Expenses, and other Key KPIs directly through Slack , ensuring executives have real-time clarity and fostering accountability. Autonomy Are leaders clear on their goals, resources, and empowered to address gaps? CFO Advisors APP 9:15 AM ⚠️ Marketing Pipeline Alert To: Head of Marketing QTD Pipeline Update: Pacing $250K Behind Target Available Resources Headcount: 2 Open Roles Budget: $120K Remaining in the Quarter Review Resourcing Dashboard Empowered Leaders Equip leaders with clear goals, necessary resources, and the authority to proactively address gaps and drive results. Velocity How quickly are good decisions surfaced, made, and implemented? Out Hire Out Innovate Out Compete OPERATIONAL EXCELLENCE Accelerated Execution Increase the speed at which quality decisions are surfaced, made, and implemented across the organization. Actual ARR vs Board Plan Actual ARR vs Board Plan Our product suite delivers custom dashboards for Revenue, Headcount, Expenses, and other Key KPIs directly through Slack, ensuring executives have real-time clarity . Strategic Focus Ensure board, management, and team alignment on strategic priorities and the critical metrics that matter most. CFO Advisors APP 6:00 AM 📊 Live Pied Piper AI Departmental Budget Data as of 2025-04-14 01:02:58 View Full Dashboard Departmental Budget Summary (42 KB) ▼ 💡 Notable Expenses over the last 7 Days 💡 Date Amo CFO Advisors | Operational Excellence Most finance functions create operational tax We help companies create operational excellence Transparency Do we understand what happened and why? Actual ARR vs Board Plan Actual ARR vs Board Plan Our product suite delivers custom dashboards for Revenue, Headcount, Expenses, and other Key KPIs directly through Slack, ensuring executives have real-time clarity . Alignment Are the board, management, and employees aligned on the key bets & critical few metrics? Strategic Focus Ensure board, management, and team alignment on strategic priorities and the critical metrics that matter most. Accountability Does strategy, prioritization, or resourcing change when you beat or miss targets? CFO Advisors APP 6:00 AM 📊 Live Pied Piper AI Departmental Budget Data as of 2025-04-14 01:02:58 View Full Dashboard Departmental Budget Summary (42 KB) ▼ 💡 Notable Expenses over the last 7 Days 💡 Date Amount Vendor Department Account ---------- --------- -------------------------- ----------------------- ----------------- 2025-04-07 $ 10,050 ICE Mortgage Techno General & Administrative Rev Share 2025-04-09 $ 8,625 Depth Public Relati Marketing Professional Fees 2025-04-12 $ 6,527 UAB Proprietas General & Administrative Facilities 2025-04-11 $ 5,000 The Mortgage Collab Marketing Advertising 2025-04-11 $ 3,294 Amazon Research & Development Professional Fees 2025-04-10 $ 7,110 CloudFlare Services Infrastructure Cloud Services 2025-04-08 $ 4,500 Stripe Payments Sales Payment Processing Performance Driven Our product suite delivers custom dashboards for Revenue, Headcount, Expenses, and other Key KPIs directly through Slack , ensuring executives have real-time clarity and fostering accountability. Autonomy Are leaders clear on their goals, resources, and empowered to address gaps? CFO Advisors APP 9:15 AM ⚠️ Marketing Pipeline Alert To: Head of Marketing QTD Pipeline Update: Pacing $250K Behind Target Available Resources Headcount: 2 Open Roles Budget: $120K Remaining in the Quarter Review Resourcing Dashboard Empowered Leaders Equip leaders with clear goals, necessary resources, and the authority to proactively address gaps and drive results. Velocity How quickly are good decisions surfaced, made, and implemented? Out Hire Out Innovate Out Compete OPERATIONAL EXCELLENCE Accelerated Execution Increase the speed at which quality decisions are surfaced, made, and implemented across the organization. Actual ARR vs Board Plan Actual ARR vs Board Plan Our product suite delivers custom dashboards for Revenue, Headcount, Expenses, and other Key KPIs directly through Slack, ensuring executives have real-time clarity . Strategic Focus Ensure board, management, and team alignment on strategic priorities and the critical metrics that matter most. CFO Advisors APP 6:00 AM 📊 Live Pied Piper AI Departmental Budget Data as of 2025-04-14 01:02:58 View Full Dashboard Departmental Budget Summary (42 KB) ▼ 💡 Notable Expenses over the last 7 Days 💡 Date Amo Terms of Service - CFO Advisors Terms of Service 1. APPLICABLE TERMS . Every engagement agreement (each, an “ Agreement ”) including all Orders entered into by CFO Advisors LLC, a California limited liability company (“ Advisor ”) are bound by (a) all the terms and conditions set forth below (these “ Terms of Service ”); (b) the Advisor terms of use located at www.CFOadvisors.com/terms-of-use/ (as the same may be updated from time to time, the “ Terms of Use ”); and (c) the Advisor privacy policy located at www.CFOadvisors.com/privacy-policy/ (as the same may be updated from time to time, the “ Privacy Policy ”). In addition, the commercial terms, to include the software and services provided and the applicable fees charged, of any prior contract or other agreement between Advisor and Client will now be bound by this Agreement and the terms and conditions of any such prior agreement will now be superseded in their entirety by this Agreement. Capitalized terms not defined herein have the same meaning as set forth in the applicable Agreement and capitalized terms not defined in an Agreement have the same meaning as set forth below. 2. DEFINITIONS . In this Agreement and each Order, the following terms shall have the following meanings, and such meanings shall apply to both singular and plural forms of any such terms: “ Advisor Materials ” means the Software, APIs, Documentation and Advisor Systems and any and all other information, data, documents, materials, works and other content, devices, methods, processes, hardware, software and other technologies and inventions, including any deliverables, technical or functional descriptions, requirements, plans or reports, that are provided or used by Advisor or any subcontractor or Third-Party Provider in connection with the Services or otherwise comprise or relate to the Services or Advisor Systems, including, for the purposes of this Agreement, as between the parties, Advisor Third-Party Tools and Data. For the avoidance of doubt, Advisor Materials include Usage Data. “ Advisor Site ” means https://CFOadvisors.com/ including all subdomains and as the same may be updated from time to time. “ Advisor Systems ” means the information technology infrastructure used by or on behalf of Advisor in performing the Services, including all computers, software, Advisor Site, any Advisor application designed for mobile or other specific devices, hardware, databases, electronic systems (including database management systems) and networks, whether operated directly by Advisor or through the use of Third-Party services. “ Advisor Third-Party Tools and Data ” means the Third-Party tools, software, services, content, materials, information, documents, specifications, products, equipment or components of or relating to the Services that are procured by Advisor from Third-Party Providers and with which any or all of the Services, including the Software, interoperate. “ Client Data ” means information, data and other content"
Greater San Diego Air Conditioning,https://www.gsdac.com,1,"Home | Greater San Diego Air Conditioning Co., Inc top of page More About Us We Can Help! San Diego's Leading Commercial HVAC Provider Greater San Diego Air Conditioning Company, Inc, a leading HVAC Service and Construction Contractor in San Diego since 1983. Looking for a reliable, trustworthy, and efficient HVAC Contractor to tackle your projects, preventative maintenance or repairs? Then you’ve come to the right place. With a diverse portfolio of contracting work and the experience to manage a large variety of different projects Contact Us! Commercial Heating and Air Conditionings Finest At Greater San Diego Air Conditioning Company, Inc, our business strategy is centered around providing exceptional service to our clients by treating their buildings as if they were our own. We take a personalized approach to each project and provide practical solutions that are tailored to the unique needs of each client. As industry experts, we understand that heating and cooling systems have a finite lifespan, and when they reach the end of their life cycle, it can be challenging to determine the most cost-effective solution. We strive to provide our clients with a range of options, including HVAC repair or replacement options, to help them make an informed decision on cost management. Free Estimate Today! bottom of page"
Anderson Air Conditioning LP,https://www.aac-ams.com,1,"Home | Anderson Air Conditioning, L.P. | Fullerton, CA Skip to primary navigation Skip to main content Fast, Reliable Commercial HVAC Service and Repairs HVAC breakdowns can be disruptive to your business. At Anderson Air Conditioning, L.P., we offer top-quality commercial HVAC solutions to fix your equipment issues and restore comfort to your workplace as soon as possible. Let us help you keep your operations running smoothly! Learn More 100+ Years of Combined HVAC Experience As a certified commercial HVAC contractor, Anderson Air Conditioning, L.P. is here to deliver exceptional heating and cooling services. Whether you’re a small office or a large industrial complex, we are committed to providing expert services. Learn More Ensure a Seamless HVAC Installation and Setup When installing a new heating or cooling unit, you need a professional like Anderson Air Conditioning, L.P. Our skilled HVAC technicians take care of everything, offering quality systems that provide consistent temperature control and air quality. Learn More Request A Quote * Name: * Phone Number: * Email Address: Interested In: Interested In: Commercial HVAC Installation Commercial HVAC Service & Repair Building Automation Commercial Refrigeration Installation & Repair * Message: This site is protected by reCAPTCHA and the Google Privacy Policy and Terms of Service apply. Send Request I provide my express consent to Anderson Air Conditioning, L.P. to contact me via Phone, Email and/or SMS so that I may set an appointment and receive informational updates and offers. I understand that my consent is not a requirement for purchase, and I may withdraw my consent at any time. We will never share your information. Reply HELP for help. Privacy Policy I provide my express written consent to Anderson Air Conditioning, L.P. to contact me via Phone, Email and/or SMS so that I may set an appointment and receive informational updates and offers no more than 2-4 times/month. Standard messaging and data rates apply. Text STOP to opt-out at anytime. Reply HELP for help. Privacy Policy Welcome to Anderson Air Conditioning, L.P. Experience Unmatched HVAC Solutions Since 1969 Anderson Air Conditioning, L.P. has been at the forefront of providing Southern California businesses with top-tier HVAC services and solutions since 1969. As a full-service commercial HVAC contractor, our journey has been marked by consistent growth and an unwavering commitment to meeting the diverse needs of small and large businesses alike. In partnership with our parent company, AMS America INC. G.P., we extend our expertise nationally, catering to commercial, industrial, and institutional property owners and managers. A Partner You Can Depend On Our business model revolves around forming lasting partnerships with our customers. We believe in building long-term relationships that are grounded in trust, value, and a solution-driven approach. We are an employee-centered company that prides itself on fixing mistakes promptl Commercial HVAC Installation | Anderson Air Conditioning, L.P. | Fullerton, CA Skip to primary navigation Skip to main content Commercial HVAC Installation | Services | Commercial HVAC Installation HVAC Installation Services at Anderson Air Conditioning, L.P. Customized HVAC Solutions for Every Need Anderson Air Conditioning, L.P. is well-versed in assessing the unique requirements of any building, room, or structure to design and implement the necessary systems for creating optimal environmental conditions. With the endorsement of Licensed Professional Mechanical Engineers, each system is designed, engineered, and slated for installation and maintenance, guaranteeing conformity to the highest standards. Whether your project demands intricate temperature or humidity control, or simpler system needs, we are equipped to identify and implement the most applicable systems and controls. Our proficiency extends beyond mere installation. Anderson Air Conditioning, L.P. takes pride in offering turn-key solutions encompassing the entire spectrum of HVAC, retrofit, and design/build and plan/spec construction solutions. Supported by comprehensive licenses in General Contracting (B), HVAC (C-20), Electrical (C-10), and Refrigeration (C-38), our capabilities are broad and inclusive, ensuring a seamless execution of your HVAC project from start to finish. Comprehensive In-House Services Understanding the interconnected nature of construction and HVAC systems, Anderson Air Conditioning, L.P. brings an added advantage to the table. Our in-house services cover framing, roofing, and electrical work, allowing for a cohesive and integrated approach to project management. This synergy not only simplifies the project execution process but also elevates the quality and efficiency of the installation, affirming our commitment to delivering increased value to every customer. Diverse HVAC Installation Capabilities Our extensive range of HVAC installation capabilities caters to various sectors and needs. From commercial offices, industrial spaces, and manufacturing plants to specialized environments like clean rooms, computer rooms, and laboratories, our team is adept at delivering customized solutions. Tailored installations such as office space setups, tenant improvements, cell site enclosures, and refrigeration systems underscore our versatility and technical proficiency. Moreover, our expertise in retrofit or change-outs, control systems, ventilation, and air distribution systems exemplify our comprehensive service range. Ensuring Seamless Implementation Every aspect of our service, from conceptualizing the appropriate system to executing detailed blueprints and securing necessary permits, is handled meticulously. Our turn-key approach extends to retrofitting and upgrading existing systems, facilitating unit replacements, and addressing unique structural or environmental requirements. Anderson Air Conditioning, L.P. ’s end-to-end services underscore our dedication to n Commercial HVAC Service & Repair | Anderson Air Conditioning, L.P. | Fullerton, CA Skip to primary navigation Skip to main content Commercial HVAC Service & Repair | Services | Commercial HVAC Service & Repair HVAC Service & Repair at Anderson Air Conditioning, L.P. Reliable HVAC Solutions for Commercial, Industrial, and Institutional Facilities / Properties At Anderson Air Conditioning, L.P. , we take pride in delivering exceptional HVAC service and repair solutions tailored to the needs of our clients. Whether it’s a minor repair or a complex system overhaul, our expert team is committed to keeping your HVAC systems running at peak performance. With our extensive industry experience, we ensure that your heating, cooling, ventilation, and refrigeration needs are met with precision and professionalism. Expert HVAC Repairs and Maintenance Programs Anderson Air Conditioning, L.P. stands at the forefront of delivering comprehensive HVAC service and repair solutions. We pride ourselves on our ability to service and repair all makes, brands, and models of HVAC systems, from small package units to extensive chiller systems. Our experienced technicians are adept at repairing a wide range of components, including heating, ventilation, cooling, refrigeration, and humidification systems, all at highly competitive rates. At Anderson Air Conditioning, L.P. , we ensure that each repair is performed with the highest standards of quality and efficiency. Maintaining the optimal performance of your HVAC system is our top priority. That’s why we offer customized maintenance programs, including our standard preventative and predictive maintenance program. A properly maintained air conditioning system can operate on up to one-third less energy than one not properly maintained. It can also significantly reduce the frequency of repair and service calls, which decreases downtime and improves indoor air quality. In addition, the life expectancy of the equipment should be appreciably extended. Our agreements are especially tailored to meet each customer’s unique needs, ensuring your systems run smoothly and efficiently. With services ranging from periodic operational inspections as per the manufacturer’s requirements to seasonal startups and shutdowns, annual belt replacements, coil cleanings, and filter replacements during each inspection, we’ve got you covered. A detailed technical inspection report follows each scheduled maintenance visit, providing you with insights into your equipment’s condition. 24/7 Emergency HVAC Repairs and Cost-Effective Solutions Understanding the critical nature of HVAC systems, we ensure our service & repair solutions are unmatched. We staff two full-time dispatchers during regular operating hours, and an after-hours call line that goes directly to our on-call technicians guaranteeing that our skilled HVAC technicians are available 24/7 for emergency repairs. Our in-house operations allow us to offer very competitive labor rates, ensuring t"
Pattonac,https://www.pattonac.com,1,"Home - PATTON BUILD. TRUST. Skip to content (559)-486-5222 272 N Palm Ave, Fresno, CA 93701 info@pattonac.com Ca License #256026 OUR SERVICES ENGINEERING DESIGN APPROACH View More BIM LEADERSHIP COORDINATED APPROACH View More CONSTRUCTION SAFETY View More INDOOR AIR QUALITY PERFORMANCE GOALS View More ENERGY OPTIMIZATION EFFICIENCY & FUNCTIONALITY View More SERVICE CONTACT US Contact Us A FRESNO, CA AIR Conditioning AND HEATING COMPANY Patton designs, builds, services and maintains mechanical, electrical, plumbing and automation systems. Patton has completed over $200 million of Design Build Projects. The Patton engineering team has acted as engineer of record on hundreds of projects, ranging from public works and energy to OSHPD acute service and University and Education buildings. Patton has adapted Lean Construction strategies, including the Target Value Design model for project delivery which eliminates waste and promotes design elements and installation methods that add the most value to the project. Patton teams provide building owners and operators with complete service throughout the building life cycle. Patton has expertise in all types of air conditioning, heating, plumbing, and electrical systems, specifically: Rooftop packaged air conditioning units Variable Air Volume (VAV) systems Energy solutions Utility rebates Duct and piping systems Indoor air quality assessments Central chiller plants Central boiler plants Steam Boilers Steam piping systems Humidification systems patton AIR CONDITIONING SERVICES THESE AREAS: Clovis, CA Merced, CA Bakersfield, CA Reedley, CA Fresno, CA San Jose, CA Madera, CA Lemoore, CA Words From Customers INTEGRITY Having Patton as an integral part of our team on numerous projects, I’m always impressed with the high level of planning, execution and quality the client receives. We can always count on Patton to deliver on their commitments with integrity and a dedication to safety. — MIKE SCHUSSEL QUIRING GENERAL CLIENT SATISFACTION If the client is not happy, Patton is not happy until the job is done. Patton’s proactive attitude with the client’s needs is what separates Patton AC from other subs. — TONY PINGS ANTHONY C. PINGS ASSOCIATES TRUST If I had to select one word that embodies the Patton AC way, that is “trust.” You can trust them with any aspect of your HVAC needs. — MIKE BOGNA GL BRUNO ASSOCIATES Keep In Touch Twitter Facebook-f Dribbble Youtube Pinterest Medium Twitch Linkedin-in"
"BRYMAX Construction Services, Inc.",https://www.brymaxservices.com,1,"brymaxservices.com The premier woman-owned and operated HVAC Services company About Us Our values Our Services Certifications BRYMAX Construction Services Inc. 7436 Lorge Circle, Huntington Beach, California 92647, United States (949) 200-9619 Get directions BRYMAX Construction Services Inc. Serving the greater Los Angeles county since 2015 This website uses cookies. We use cookies to analyze website traffic and optimize your website experience. By accepting our use of cookies, your data will be aggregated with all other user data. Accept Our Services Our Services BRYMAX Construction Services, Inc. is a certified SBE, WBE, woman-owned and operated Mechanical Construction Company founded in 2015 and based in the greater Los Angeles area, with over 200 years of combined engineering expertise in our seasoned and experienced team. Clients who enlist our services benefit from fulfilling the diversity compliance standard on all federal, state, and public work projects that require SBA, WBE, or WOSB participation. BRYMAX is a signatory Union HVAC Subcontractor with a focus on Design-Build and Design-Assist HVAC Projects, bringing over 200 years of trusted construction and engineering experience to the job site, with highly qualified Designers, Project Managers, and Field Supervision overseeing from inception to completion. BRYMAX is managed with elevated expectations and cuts no corners nor spares any attention to rigorous detail to the benefit of our clients. BRYMAX specializes in providing solutions for various construction needs including the following: - C-20 HVAC Subcontractor with Self-Performed Manpower, Procurement Management and Subcontractor Mgmt. - Signatory Union Labor with Sheet Metal, Plumbing and Piping - Procurement Management Services complying with the Commercial Useful Function obligations mandated by Public, State and Federal Agencies. - Consulting services including Design Build Pursuits, Peer Review, Engineering, Construction and Cost Mgmt. - Strategic Partnership for Project Pursuits including Pre-construction, Estimating and Conceptual Engineering. BRYMAX Construction Services, Inc. is here to provide functional solutions and a tailored response to your desired project, per your specifications, budgetary constraints, and timeframe by using our decades of trusted experience to ensure a satisfactory completion. Photo Gallery BRYMAX Construction Services Inc. Serving the greater Los Angeles county since 2015 This website uses cookies. We use cookies to analyze website traffic and optimize your website experience. By accepting our use of cookies, your data will be aggregated with all other user data. Accept"
