company_name,website_url,label_relevance,scraped_text
Notion Labs,https://www.notion.so,0,"The AI workspace that works for you. | Notion Play Trusted by top teams Introducing Notion 3.0 Hand off your busywork What used to take days in minutes. Tell it your goal and watch it work. Collaborates with your team It's like having a built-in power user that works alongside your team. Knows everything you know Searches all your pages, messages, files, and the web to surface exactly what you need. Personalized to you Your Agent learns how you work. You control everything from how it behaves to how it looks. Your AI everything app. More productivity. Fewer tools. Bring all your tools and teams under one roof. Calculate savings below. See pricing plans → AI Search $35/user AI Chatbot $20/user AI Meeting Notes $18/user AI Writing Assistant $20/user AI Email App $30/user AI Research $40/user Calendar Scheduling $15/user Team Wiki $10/user Project Management Tool $24/user Basic CRM $20/user Site Builder $20/user Forms $15/user Team size Monthly savings $0 Annual savings $0 Trusted by teams that ship. There’s power in a single platform where you can do all your work. Notion is that single place. Read the full story → View the video Streamlined workflows to reduce timelines by 3x. → “With Notion, every person at Ramp has an AI agent.” → “Notion understands that you can solve a lot of problems with one tool.” → “Notion has been the most powerful and impactful way to streamline our workflow.” → “Using the most AI‑native tools like Notion is an important competitive advantage for us.” → One hub for work and AI keeps everyone informed and work flowing. → Over 100M users worldwide #1 knowledge base 3 years running (G2) #1 AI enterprise search (G2) #1 rated AI writing (G2) 62% of Fortune 100 Over 50% of YC companies 1.4M+ community members Over 100M users worldwide #1 knowledge base 3 years running (G2) #1 AI enterprise search (G2) #1 rated AI writing (G2) 62% of Fortune 100 Over 50% of YC companies 1.4M+ community members Over 100M users worldwide #1 knowledge base 3 years running (G2) #1 AI enterprise search (G2) #1 rated AI writing (G2) 62% of Fortune 100 Over 50% of YC companies 1.4M+ community members Let Notion AI handle the busywork. Pick a use case to see how Notion does the work for you. Explore more → Go from brainstorm to roadmap → Turn meetings into social posts → Organize your workspace → Onboard a new hire → Revise a landing page → Plan an offsite → Track favorite restaurants → Transform notes into tasks → Try for free. Get started on Notion Your AI workspace with built-in agents. Download for Windows Notion Mail The AI inbox that thinks like you. Download Notion Calendar Time, scheduling, tasks—all together. Download Notion is always at home right in your browser . Build AI agents that work for you | Notion Agents that work while you sleep. Automate repetitive tasks Streamline specific workflows Create and share them across your workspace Questions & answers When will Custom Agents launch? We're excited to bring Custom Agents to Notion soon! We're currently in alpha and refining the experience based on user feedback. We'll notify you when Custom Agents become more widely available. When will I hear back? Thanks for your interest! We'll review all submissions and reach out as we expand access to Custom Agents. In the meantime, you can start using Notion Agent today. It’s available now on Business and Enterprise plans and can handle many of the same workflows. Users on Free and Plus will be able to try it out. Try asking Notion Agent to help you with new hire onboarding , or show you what it can do . I'm excited about Custom Agents. What should I do now? Great! Here's what you can do: Start with Notion Agent today – Available now on Business and Enterprise plans, Notion Agent can handle many powerful workflows like compiling feedback, generating reports, and building databases. The main difference is you prompt it each time instead of it running automatically. Explore use cases – Check out our use case library to see what's possible with Notion AI Stay tuned – We'll keep you updated as Custom Agents become available How are Custom Agents different from the Notion Agent in the bottom right corner? Notion Agent is your personal AI assistant that's available now. It completes complex, multi-step tasks from a single prompt—like creating databases, analyzing data, and generating reports. You work with it through chat whenever you need it. Custom Agents (coming soon) can run automatically on schedules or triggers, can be shared across your team, and have more granular permissions. The good news: Most workflows you're imagining for Custom Agents can be accomplished with Notion Agent today—you'll just prompt it each time instead of it running automatically. Enterprise Search Software | AI-Powered Workspace Search – Notion Enterprise Search Every answer, one search. Answers in seconds and detailed reports delivered in minutes, right where your teams already work. Get Notion free Watch demo video Pause Uh-oh! It looks like your ad blocker is preventing the video from playing. Ranked #1 by G2 How does Notion stack up? See a side-by-side breakdown of features, security, and value to understand why teams choose Notion. Compare Notion and Glean → What used to take hours of debugging can now be solved in minutes just by asking Notion AI. John Allard Engineering, OpenAI Find answers, wherever they’re hiding. See Enterprise Search in action -> Search across apps With AI connectors, you can integrate your favorite work tools. Notion AI will search across all of them to find exactly what you need. Instant answers Get up-to-date answers with context to unblock work. Results you can trust Every answer includes verified content and citations, using only the sources you choose. Notion AI is saving new employees days, if not weeks, of their onboarding to be able to find information quickly and learn from it. Scott Entwistle Senior Recruiter, Remote We’re getting at least a day back every week! It quickly processes knowledge, provides accurate answers and allows us to draft new content or initiate other tasks within seconds. Matthias Lambrecht Product Owner, ecosio It’s really powerful when Notion AI surfaces organizational knowledge that I didn’t know to look for, because I didn’t even know it existed. Faith Lierheimer Senior Technical Instructor, dbt Labs Research Mode: search that does the work. Create detailed reports in minutes that you can save and share, pulling from all your sources and the web. Saves you days of time Analyzes your workspaces, apps, and even the web in minutes. Thinks hard for you Watch Notion AI break down questions into a multi-step research process. Writes ready-to-share reports Get polished, thorough reports you can instantly save and share without extra work. Never start docs from scratch. Create project updates from scattered sources. Create weekly summaries of progress and blockers, including the latest context from Jira tickets, GitHub PRs, and team discussions in Slack or Microsoft Teams. Customer research reports, in minutes. Accelerate product development with faster feedback. Research Mode analyzes research calls, Zendesk tickets (Coming soon), and discovers relevant feedback across the web. Come prepared to every meeting. Customer call coming up? Research mode gathers competitive intel from internal docs, the web and Salesforce (Coming soon) to get you ready. Search & analyze, your way. Choose your AI models Start chatting with your preferred AI models right where you work. No additional charge and no training on your data. Searches uploaded PDFs Notion AI will search any uploaded PDFs in your Notion workspace, Google Drive, SharePoint, and OneDrive. Search safely. Learn more ab"
Airtable,https://www.airtable.com,0,"Airtable: AI App Building for Enterprise - Airtable Introducing a new product from Airtable Sorry, your browser doesn’t support embedded videos. Superagent turns your complex business questions into boardroom-ready answers — exhaustively researched, fact-checked, and beautifully rendered into reports, slides, or websites. Try it out Airtable is the fastest way to build AI-enabled workflows Learn how Airtable enables teams to build no-code workflows that unify data, help them collaborate easily, and set them up for long-term success. Get started for free Book demo Sorry, your browser doesn’t support embedded videos. Trusted by 500,000 leading teams Sophisticated workflows in minutes, not months Production apps at prototype speed Streamline your team’s critical data through conversational building. Generate apps with Airtable’s best-in-class no-code components—no technical expertise required. Learn more Sorry, your browser doesn’t support embedded videos. Don’t just ask AI. Deploy it. Embed intelligence into every workflow—Airtable agents think dynamically across thousands of records and orchestrate actions across your entire operation. Learn more Say hello to Omni Use it to build any enterprise-grade applications with your data. The possibilities are endless. Learn more The power of AI with the industrial-grade platform your business demands Scalable infrastructure HyperDB with record limits in the hundreds of millions Scale workflows to tens of thousands of users Use AI models from leading providers (OpenAI, Gemini, Llama, Anthropic, and more) Flexible administration Admin roles, robust permissions, fine-grained RBAC Fine-grained controls to enable AI Programmatic provisioning and de-provisioning IDP synced groups Security and compliance ISO, HIPAA, SOC 2 No customer data retained or used to train AI models Models run fully in Airtable’s AWS environment EKM, data loss prevention, audit logs, e-discovery European and Australian data residency support The path to 10x every person in your organization Use cases and templates to activate AI in your workflows See AI plays Read this brief and generate 10 campaign ideas for our summer launch. Explore AI Plays Gather intel on all event invitees to help me personalize outreach. Explore AI Plays What are customers saying about our competitors and where are our biggest opportunities? Explore AI Plays Run language translation on 500 assets and check for local regulation requirements. Explore AI Plays Resources to inspire Builders & Breakthroughs Hear from top product leaders as they share the pivotal insights and decisions behind building great products—hosted by Airtable CEO Howie Liu. The 2026 AI guide for marketers Learn how to prep your marketing organization for AI integration and layer Airtable across your most critical marketing workflows. In action: Airtable ProductCentral See how Airtable ProductCentral delivers a complete view of product investments at every altitude, infusing AI at each step of th In action: Airtable ProductCentral - Airtable Demo In action: Airtable ProductCentral ProductCentral unifies your entire product development process, from strategy to delivery. Aligned teams build breakthrough products. Leading product teams use Airtable ProductCentral to align against a complete view of product investments at every altitude, infusing AI into each step of the process. * First Name * Last Name * Work Email * Phone Number United States + 1 United Kingdom + 44 Afghanistan + 93 Albania + 355 Algeria + 213 Andorra + 376 Angola + 244 Antigua and Barbuda + 1268 Argentina + 54 Armenia + 374 Aruba + 297 Australia + 61 Austria + 43 Azerbaijan + 994 Bahamas + 1242 Bahrain + 973 Bangladesh + 880 Barbados + 1246 Belarus + 375 Belgium + 32 Belize + 501 Benin + 229 Bhutan + 975 Bolivia + 591 Bosnia and Herzegovina + 387 Botswana + 267 Brazil + 55 British Indian Ocean Territory + 246 Brunei + 673 Bulgaria + 359 Burkina Faso + 226 Burundi + 257 Cambodia + 855 Cameroon + 237 Canada + 1 Cape Verde + 238 Caribbean Netherlands + 599 Cayman Islands + 1 Central African Republic + 236 Chad + 235 Chile + 56 China + 86 Colombia + 57 Comoros + 269 Congo + 243 Congo + 242 Costa Rica + 506 Côte d'Ivoire + 225 Croatia + 385 Curaçao + 599 Cyprus + 357 Czech Republic + 420 Denmark + 45 Djibouti + 253 Dominica + 1767 Dominican Republic + 1 Ecuador + 593 Egypt + 20 El Salvador + 503 Equatorial Guinea + 240 Eritrea + 291 Estonia + 372 Ethiopia + 251 Fiji + 679 Finland + 358 France + 33 French Guiana + 594 French Polynesia + 689 Gabon + 241 Gambia + 220 Georgia + 995 Germany + 49 Ghana + 233 Greece + 30 Greenland + 299 Grenada + 1473 Guadeloupe + 590 Guam + 1671 Guatemala + 502 Guinea + 224 Guinea-Bissau + 245 Guyana + 592 Haiti + 509 Honduras + 504 Hong Kong + 852 Hungary + 36 Iceland + 354 India + 91 Indonesia + 62 Iraq + 964 Ireland + 353 Israel + 972 Italy + 39 Jamaica + 1876 Japan + 81 Jordan + 962 Kazakhstan + 7 Kenya + 254 Kiribati + 686 Kosovo + 383 Kuwait + 965 Kyrgyzstan + 996 Laos + 856 Latvia + 371 Lebanon + 961 Lesotho + 266 Liberia + 231 Libya + 218 Liechtenstein + 423 Lithuania + 370 Luxembourg + 352 Macau + 853 Macedonia + 389 Madagascar + 261 Malawi + 265 Malaysia + 60 Maldives + 960 Mali + 223 Malta + 356 Marshall Islands + 692 Martinique + 596 Mauritania + 222 Mauritius + 230 Mayotte + 262 Mexico + 52 Micronesia + 691 Moldova + 373 Monaco + 377 Mongolia + 976 Montenegro + 382 Morocco + 212 Mozambique + 258 Myanmar + 95 Namibia + 264 Nauru + 674 Nepal + 977 Netherlands + 31 New Caledonia + 687 New Zealand + 64 Nicaragua + 505 Niger + 227 Nigeria + 234 Norway + 47 Oman + 968 Pakistan + 92 Palau + 680 Palestine + 970 Panama + 507 Papua New Guinea + 675 Paraguay + 595 Peru + 51 Philippines + 63 Poland + 48 Portugal + 351 Puerto Rico + 1 Qatar + 974 Réunion + 262 Romania + 40 Russia + 7 Rwanda + 250 Saint Kitts and Nevis + 1869 Saint Lucia + 1758 Saint Vincent and the Grenadines + 1784 Samoa + 685 San Marino + 378 São Tomé and Príncipe + 239 Saudi Ara"
Zapier,https://www.zapier.com,0,"Zapier: Automate AI Workflows, Agents, and Apps 🗓️ Kickstart your AI fluency in 2026. Four hands-on workshops this January . → Transformative AI for every team Zapier unlocks transformative AI to safely scale workflows, agents, and MCP with the world's most connected ecosystem of 8,000+ integrations. Start free with email Start free with Google Soc 2 (type II) - GDPR - CCPA GDPR and CCPA compliant Trusted by the world’s best companies Trusted by the world’s best companies Your complete toolkit for AI automation AI Workflows AI Agents AI Chatbots Tables Forms Canvas Enterprise Functions 8,000 apps AI Workflows Automate advanced workflows with the full building power of Zapier. Explore AI Workflows Get started fast with pre-built templates Let AI handle your IT support tickets Turn sales calls into coaching moments See more templates → CUSTOMER STORIES For the Fortune 500 and first-time founders Teams use Zapier in boardrooms, spare rooms, and rooms where AI has ROI. With Agents, I’m getting insights I didn’t even know to look for. They flag when something’s off, answer questions in plain language, and save me hours every week. — Spencer Siviglia , Director of Operations at Toyota of Orlando 30,000+ lead records managed 20+ hours saved weekly Read full story What used to be overwhelming is now scalable. With Zapier, I don’t have to choose between doing good work and doing a lot of it. — Andrew Harding , VP of Marketing and Content Partnerships at Slate 2,000+ new leads a month 100+ hours saved Read full story Zapier lets us spin up and test automations in hours, not full engineering sprints. — Korey Marciniak , Senior Manager of Customer Support Strategy and Operations 13% of support escalations fully automated with Zapier 10 min saved per escalation Read full story Because of automation, we've seen about a $1 million increase in potential revenue. Our reps can now focus purely on closing deals—not admin. — Jacob Sirrs , Marketing Operations Specialist at Vendasta $1M In recovered pipeline using automation 282 Days per year of manual work removed Read full story Zapier contributes to an overhead savings of around $500,000+ on an annual basis — Tyler Diogo , Operations Manager, Arden Insurance Services 34,000+ Work hours automated $150m Zapier helps collect $150m in payments / year Read full story With the help of automation, Contractor Appointments has been able to help our clients report over $134 million in revenue. — Ben Leone , CTO, Contractor Appointments $300k increase in annual revenue with automation 80-90% top-of-funnel leads handled automatically Read full story See more customer stories Scale AI the Easy Way No AI hype here. Just results. 0 1 2 3 4 5 6 7 8 9 0 1 2 3 4 5 6 7 8 9 0 1 2 3 4 5 6 7 8 9 , 0 1 2 3 4 5 6 7 8 9 0 1 2 3 4 5 6 7 8 9 0 1 2 3 4 5 6 7 8 9 , 0 1 2 3 4 5 6 7 8 9 0 1 2 3 4 5 6 7 8 9 0 1 2 3 4 5 6 7 8 9 AI tasks automated on Zapier (and counting) Jan 2023 Today Zapier is where innovators put AI to work. Connect AI directl"
Calendly,https://www.calendly.com,0,"Free Online Appointment Scheduling Software | Calendly Trusted by more than 100,000 of the worldâs leading organizations Calendly makes scheduling simple Calendlyâs easy enough for individual users, and powerful enough to meet the needs of enterprise organizations â including 86% of the Fortune 500 companies. Sign up for free Connect your calendars Calendly connects up to six calendars to automate scheduling with real-time availability. Add your availability Keep invitees informed of your availability. Take control of your calendar with detailed availability settings, scheduling rules, buffers, and more. Connect conferencing tools Sync your video conferencing tools and set preferences for in-person meetings or calls. Customize your event types Choose from pre-built templates or quickly create custom event types for any meeting you need to schedule. Share your scheduling link Easily book meetings by embedding scheduling links on your website, landing pages, or emails. Connect Calendly to the tools you already use Boost productivity with 100+ integrations View all integrations Google suite Get your job done faster by connecting Calendly to Google Calendar, Meet, Analytics, and more. Microsoft suite Make your day easier with Calendly integrations for Microsoft Teams, Outlook, Azure SSO , and more. Pick the perfect plan for your team Billed yearly Billed monthly Billed yearly Free For personal use Always free Get started Standard Yearly For professionals and small teams $10 /seat/mo Save 16% Get started Teams Yearly Recommended plan For growing businesses $16 /seat/mo Save 20% Try for Free Enterprise For large companies Starts at $15k /yr Talk to sales Free For personal use Always free Get started Standard Yearly For professionals and small teams $10 /seat/mo Save 16% Get started Teams Yearly Recommended plan For growing businesses $16 /seat/mo Save 20% Try for Free Enterprise For large companies Starts at $15k /yr Talk to sales Learn more on our pricing page Discover how businesses grow with Calendly View customer stories 169 % return on investment Read now 160 % increase in customers reached Read now 20 % decrease in scheduling errors Read now 8 days reduction in time-to-hire Read now 26 % increase in website bookings Read now Built to keep your organization secure Keep your scheduling data secure with enterprise-grade admin management, security integrations, data governance, compliance audits, and privacy protections. Learn more Power up your scheduling Get started in seconds â for free. Start for free Get a demo"
Loom,https://www.loom.com,0,"Free screen recorder for Mac and PC | Loom Skip to content Millions of people across 400,000 companies choose Loom Get Loom for free View more Read the review Open in new window 1:1 with Dereje 1:1 with Sonya Focus Work Quarterly Budget Meeting Project Review Q4 Campaign Results Results Report 0:00 Record now Can you show me how to require two-factor authentication for my team? Of course! Here’s a short walkthrough of the steps you’ll need to take: loom.com/share/28u2o923 Your browser does not support the video tag. Start sharing Your browser does not support the video tag. 👍 Great point! Yes! Really love this. Connect over video Learn more See all use cases Screen and camera recording Easy sharing and embedding Trim and stitch video clips Download and upload Transcriptions and closed captions Video privacy controls Custom background Video and viewer insights See all features Read the article Read the article Explore our blog Open in new window Learn more Your browser does not support the video tag. Loom enables us to maximize our impact as a distributed company by helping us collaborate and share ideas more easily. Andrew Reynolds Design Lead , MetaLab ‘Loom has been the light of my life since you showed me it.’ – I never tire of hearing this from folks. Not even an investor... yet. Alexis Ohanian Founder , SevenSevenSix Loom allows me to connect more personally with people without having to do 75 different one-on-one calls, which is just impossible at scale. Katie Burke Chief People Officer , HubSpot My teammates and I love using Loom! It has saved us hundreds of hours by creating informative video tutorials instead of long emails or 1-on-1 trainings with customers. Erica Goodell Customer Success , Pearson Loom amplifies my communication with the team like nothing else has. It's a communication tool that should be in every executive's toolbox. David Okuinev Co-CEO , Typeform My new daily email habit. Begin writing an email. Get to the second paragraph and think 'what a time suck.' Record a Loom instead. Feel like 😎. Kieran Flanagan VP of Marketing , HubSpot Loom enables us to maximize our impact as a distributed company by helping us collaborate and share ideas more easily. Andrew Reynolds Design Lead , MetaLab ‘Loom has been the light of my life since you showed me it.’ – I never tire of hearing this from folks. Not even an investor... yet. Alexis Ohanian Founder , SevenSevenSix Loom powers great campaigns. Get Loom for free For Mac, Windows, iOS, and Android"
Miro,https://www.miro.com,0,"AI Innovation Workspace | Miro Explore how AI workflows transform the way teams work See AI Playbooks Henrik Flow from idea to outcome in seconds INSIGHTS DATA TABLE AR City Explorer Travel App Group Planner Adventure Tracker Weather Alerts Visual Reference DOC Create a PRD Doc Untitled doc Press â/â for options or start writing Choose a starting template Retrospective Summary Product Brief Research Synthesis Meeting Notes Tom Jess PROTOTYPE Drew Miro AI Rad Brie Product Marketer Design Assistant Maria INSIGHTS DATA TABLE AR City Explorer Travel App Group Planner Adventure Tracker Weather Alerts Visual Reference DOC Create a PRD Doc Untitled doc Press â/â for options or start writing Choose a starting template Retrospective Summary Product Brief Research Synthesis Meeting Notes Tom Jess PROTOTYPE Drew Miro AI Rad Brie Product Marketer Design Assistant Maria The only thing more important than moving fast is moving the needle See how over 250,000 companies are getting great done in Miro Aida Miro AI 3.6x faster time to market 50% shorter planning process 2x faster time to market Check this out 100M+ people collaborating on Miro 250+ apps and integrations 6,000+ templates âBeing able to bring everyone together to plan in Miro ultimately means that the most impactful initiatives will happen at the right time â and customers will get the functionality they want.â Lucy Starling Product Operations Lead at ASOS Read Customer Study Jess Drew Letâs go with this fit for our summer collection The only thing more important than moving fast is moving the needle See how over 250,000 companies are getting great done in Miro Aida Miro AI 3.6x faster time to market 50% shorter planning process 2x faster time to market Check this out 100M+ people collaborating on Miro 250+ apps and integrations 6,000+ templates âBeing able to bring everyone together to plan in Miro ultimately means that the most impactful initiatives will happen at the right time â and customers will get the functionality they want.â Lucy Starling Product Operations Lead at ASOS Read Customer Study Jess Drew Letâs go with this fit for our summer collection The only thing more important than moving fast is moving the needle See how over 250,000 companies are getting great done in Miro Aida 3.6x faster time to market 50% shorter planning process 2x faster time to market Check this out 100M+ people collaborating on Miro 250+ apps and integrations 6,000+ templates âBeing able to bring everyone together to plan in Miro ultimately means that the most impactful initiatives will happen at the right time â and customers will get the functionality they want.â Lucy Starling Product Operations Lead at ASOS Read Customer Study Jess Drew Letâs go with this fit for our summer collection The only thing more important than moving fast is moving the needle See how over 250,000 companies are getting great done in Miro 3.6x faster time to market 50% shorter planning process 2x faster ti"
