company_name,website_url,label_relevance,scraped_text
Total Comfort,https://www.totalcomfortinc.net,1,"Home - Total Comfort Inc. ☰ × × Air Conditioning AC Installation Air Conditioning Installation in Corona, CA AC Replacement AC Replacement In Corona, CA AC Repair Air Conditioning Repair in Corona, CA AC Service AC Service In Corona, CA Air Conditioning Maintenance Air Conditioning Maintenance In Corona, CA AC Tune-Up in Corona, CA AC Tune-Up In Corona, CA Heat Pumps Ductless Air Conditioning Ductless Air Conditioning In Corona, CA Zone Control System Thermostats QuietCool Whole–House Fans Heating Heating Installation Heating Replacement Heating Repair Heating Repair in Corona, CA Heating Service Furnaces Gas Furnace Electric Furnace Thermostats Ductless Heating Heat Pumps Zone Control System Air Quality Humidifier Dehumidifier UV Air Purifier Air Purifier Air Filtration Systems Insulation Duct Testing Duct Sealing Plumbing Plumbing Installation Plumbing Repair Plumbing Maintenance Sewer Services Sump Pumps Water Treatment Drain Services Gas Lines Leak Detection Water Testing Emergency Plumbing Bathroom Plumbing Bathtub Plumbing Bathroom Sink Plumbing Toilet Plumbing Shower Plumbing Kitchen Plumbing Kitchen Sink Plumbing Garbage Disposal Replacement Garbage Disposal Earthquake Automatic Shut Off Valve Water Heater Water Heater Installation Water Heater Replacement Water Heater Maintenance Water Heater Repair Tank Water Heater Heat Pump Water Heater Hybrid Water Heater Tankless Water Heater Promotions Ductless Mini Split Promotions and Discounts Furnace Promotions and Discounts Heat Pump Promotions and Discounts Air Conditioning Promotions and Discounts Indoor Air Quality Promotions and Discounts Home About Happy Customer Photos Total Comfort Photos Meet the Team Financing Options Products Cooling Products Air Conditioners Heat Pumps Packaged Products Heating Products Gas Furnaces Oil Furnaces Other Products Air Purifiers Evaporator Coils Geothermal Thermostats Resources Blog HVAC FAQs HVAC Troubleshooter Maintenance Service Areas Anaheim Beaumont Burbank Chino Chino Hills Corona Costa Mesa Eastvale Fontana Hemet Huntington Beach Irvine Lake Elsinore Los-Angeles Menifee Moreno Valley Murrieta Norco Orange Pasadena Perris Rancho Cucamonga Riverside San-Jacinto Santa Ana Temecula Reviews Contact Us We Install The Best and Service The Rest! Contact Us Get Filters Servicing Southern California! Contact Us Get Filters Family Comfort is Always Our Main Focus. Contact Us Get Filters Learn About HALO Water Systems Contact Us Get Filters Learn About Air Scrubber Contact Us Get Filters Previous Next Who We Serve Our staff is dedicated to your Total Comfort & Total Satisfaction Residential Light Commercial About Us Comfort is not something to be taken lightly. There are seemingly countless products and services available to help you maintain comfortable conditions in your home all year long. So many, in fact, that you may have trouble choosing just how best to cool your home or which water heater is the right fit for your needs. That is why it is so necessar Service Areas - Total Comfort Inc. ☰ × × Air Conditioning AC Installation Air Conditioning Installation in Corona, CA AC Replacement AC Replacement In Corona, CA AC Repair Air Conditioning Repair in Corona, CA AC Service AC Service In Corona, CA Air Conditioning Maintenance Air Conditioning Maintenance In Corona, CA AC Tune-Up in Corona, CA AC Tune-Up In Corona, CA Heat Pumps Ductless Air Conditioning Ductless Air Conditioning In Corona, CA Zone Control System Thermostats QuietCool Whole–House Fans Heating Heating Installation Heating Replacement Heating Repair Heating Repair in Corona, CA Heating Service Furnaces Gas Furnace Electric Furnace Thermostats Ductless Heating Heat Pumps Zone Control System Air Quality Humidifier Dehumidifier UV Air Purifier Air Purifier Air Filtration Systems Insulation Duct Testing Duct Sealing Plumbing Plumbing Installation Plumbing Repair Plumbing Maintenance Sewer Services Sump Pumps Water Treatment Drain Services Gas Lines Leak Detection Water Testing Emergency Plumbing Bathroom Plumbing Bathtub Plumbing Bathroom Sink Plumbing Toilet Plumbing Shower Plumbing Kitchen Plumbing Kitchen Sink Plumbing Garbage Disposal Replacement Garbage Disposal Earthquake Automatic Shut Off Valve Water Heater Water Heater Installation Water Heater Replacement Water Heater Maintenance Water Heater Repair Tank Water Heater Heat Pump Water Heater Hybrid Water Heater Tankless Water Heater Promotions Ductless Mini Split Promotions and Discounts Furnace Promotions and Discounts Heat Pump Promotions and Discounts Air Conditioning Promotions and Discounts Indoor Air Quality Promotions and Discounts Home About Happy Customer Photos Total Comfort Photos Meet the Team Financing Options Products Cooling Products Air Conditioners Heat Pumps Packaged Products Heating Products Gas Furnaces Oil Furnaces Other Products Air Purifiers Evaporator Coils Geothermal Thermostats Resources Blog HVAC FAQs HVAC Troubleshooter Maintenance Service Areas Anaheim Beaumont Burbank Chino Chino Hills Corona Costa Mesa Eastvale Fontana Hemet Huntington Beach Irvine Lake Elsinore Los-Angeles Menifee Moreno Valley Murrieta Norco Orange Pasadena Perris Rancho Cucamonga Riverside San-Jacinto Santa Ana Temecula Reviews Contact Us Service Areas Total Comfort Inc. > Service Areas TOTAL COMFORT, INC. SERVES THE SOUTHERN CALIFORNIA AREA ALISO VIEJO ANAHEIM ANAHEIM HILLS BEAUMONT BURBANK CANYON LAKE CHINO CHINO HILLS CORONA CORONA DEL MAR COSTA MESA COTO DE CAZA EASTVALE FONTANA FOUNTAIN VALLEY GARDEN GROVE HEMET HUNTINGTON BEACH IRVINE LAGUNA BEACH LAGUNA HILLS LAKE ELSINORE LAKE FOREST LOS ANGELES MENIFEE MISSION VIEJO MORENO VALLEY MURRIETA NEWPORT BEACH NEWPORT COAST NORCO ONTARIO ORANGE PASADENA PERRIS PLACENTIA RANCHO CUCAMONGA RANCHO SANTA MARGARITA RIVERSIDE SAN JACINTO SANTA ANA SUN CITY TEMECULA TUSTIN VILLA PARK WESTMINISTER YORBA LINDA Schedule Service Request Estimate Newsletter Sign Up Our Services Air Conditioning Heating Air Quality Plumbing Water Heater ANAHEIM, CA AIR CONDITIONING, HEATING & PLUMBING SERVICES - Total Comfort Inc. ☰ × × Air Conditioning AC Installation Air Conditioning Installation in Corona, CA AC Replacement AC Replacement In Corona, CA AC Repair Air Conditioning Repair in Corona, CA AC Service AC Service In Corona, CA Air Conditioning Maintenance Air Conditioning Maintenance In Corona, CA AC Tune-Up in Corona, CA AC Tune-Up In Corona, CA Heat Pumps Ductless Air Conditioning Ductless Air Conditioning In Corona, CA Zone Control System Thermostats QuietCool Whole–House Fans Heating Heating Installation Heating Replacement Heating Repair Heating Repair in Corona, CA Heating Service Furnaces Gas Furnace Electric Furnace Thermostats Ductless Heating Heat Pumps Zone Control System Air Quality Humidifier Dehumidifier UV Air Purifier Air Purifier Air Filtration Systems Insulation Duct Testing Duct Sealing Plumbing Plumbing Installation Plumbing Repair Plumbing Maintenance Sewer Services Sump Pumps Water Treatment Drain Services Gas Lines Leak Detection Water Testing Emergency Plumbing Bathroom Plumbing Bathtub Plumbing Bathroom Sink Plumbing Toilet Plumbing Shower Plumbing Kitchen Plumbing Kitchen Sink Plumbing Garbage Disposal Replacement Garbage Disposal Earthquake Automatic Shut Off Valve Water Heater Water Heater Installation Water Heater Replacement Water Heater Maintenance Water Heater Repair Tank Water Heater Heat Pump Water Heater Hybrid Water Heater Tankless Water Heater Promotions Ductless Mini Split Promotions and Discounts Furnace Promotions and Discounts Heat Pump Promotions and Discounts Air Conditioning Promotions and Discounts Indoor Air Quality Promotions and Discounts Home About Happy Customer Photos Total Comfort Photos Meet the Team Financing Options Products Cooling Products Air Conditioners Heat Pumps Packaged Products Heating Products Gas Furnaces Oil Furnaces Other Products Air Purifiers Evaporator Coils Geothermal Thermostats Resources Blog HVAC FAQs HVAC Troubleshooter Maintenance Service Areas Anaheim Beaumont Burbank Chino Chino Hills Corona Costa Mesa Eastvale Fontana Hemet Huntington Beach Irvine Lake Elsinore Los-Angeles Menifee Moreno Valley Murrieta Norco Orange Pasadena Perris Rancho Cucamonga Riverside San-Jacinto Santa Ana Temecula Reviews Contact Us ANAHEIM, CA AIR CONDITIONING, HEATING & PLUMBING SERVICES Total Comfort Inc. > Service Areas > ANAHEIM, CA AIR CONDITIONING, HEATING & PLUMBING SERVICES ANAHEIM, CA AIR CONDITIONING, HEATING & PLUMBING SERVICES Modern living is more convenient and comfortable than ever before. If you fail to schedule your air conditioning, heating, and plumbing services in Anaheim, CA with a skilled, qualified technician, though, you may discover what true discomfort and inconvenience truly is. To avoid such unwelcome eye openers, contact the HVAC and plumbing professionals at Total Comfort, Inc.. We are certain that we can help you live and work more comfortably, so give us a call today to schedule services in Anaheim,"
Lee's Air Conditioning,https://www.leesair.com,1,"Heating, Cooling & Plumbing Services in Fresno & Sacramento Skip to content Local and trusted Comfort Experts Serving Sacramento and Fresno since 1981 Schedule Your Service Today A/C Services Heating Services Plumbing Services Roofing Services Trusted HVAC & Plumbing Experts IN FRESNO & SACRAMENTO Lee’s Air, Plumbing, Heating & Roofing is your source for reliable heating, cooling, and plumbing throughout Central and Northern California. Since 1981, we’ve been a leading source of premium in-home services. With decades of top-notch experience under our belts, we’re proud to be an HVAC and plumbing company in Fresno and Sacramento that local residents have turned to time and again. We can trust us with your: AC Repair AC Installation Furnace Repair Furnace Installation Water Heater Installation & Repair Residential Plumbing Repair Commercial Plumbing Repair Commercial HVAC Services Request Your Appointment Step 1 of 2 50% Comments This field is for validation purposes and should be left unchanged. Name (Required) First Last Email (Required) Phone (Required) Street Address (Required) Apt or Suite # City (Required) State (Required) State CA NV AZ Postal Code (Required) Message What service is needed? (Required) What service is needed? Air Conditioning Heating Roofing Plumbing Water Heaters Would you like a call, text or email? (Required) Call Text Email By clicking 'Submit,' you consent to receiving calls, texts, or emails from us at the contact information provided. These communications may include informational or promotional content and may be sent using automated technology. Msg & data rates may apply. Reply STOP to opt out of texts or click 'Unsubscribe' in emails to stop email communications. View Privacy Policy CAPTCHA Why CHoose Lee's When it comes to HVAC and plumbing services, we stand apart through decades of expertise, integrity, and genuine care. Here’s what makes us the trusted choice in Central and Northern California: 40+ Years of Experience Community-Focused Values All-in-One Service Experts Flat-Rate, Honest Pricing Licensed & Insured Professionals Membership Options for Peace of Mind 100% Satisfaction Guarantee 4.8 Stars on Google Award-Winning Service Schedule Your Service Today See What Our Customers Say 0 + Google Reviews Stephanie R. Lee’s installed a new furnace and AC at my house. Turn around time from quote to install was so fast and the guys that did install were professional and friendly. I would highly recommend Lee’s for a straightforward, honest service. Zach D. Ronnie was nice and professional. He was able to provide me with pictures showing where our AC inefficiencies were coming from and informed us about some of the most recent rebates available if we wanted to pursue fixing or replacing our AC. He was very informative and helpful. Bri C. Would definitely recommend this company! Chadd worked with us and got the technician out there fast during the summer when our ac broke! Even though they must have been very busy he"
Kahn Air Conditioning,https://www.kahnair.com,1,"HVAC Company in Van Nuys, CA | AC Repair & Heating Service Skip to main content Emergency Service Available! Call 818-886-2600 ABOUT LOCATIONS TESTIMONIALS CONTACT Serving Southern California Since 1961 Schedule Service Schedule Service Book online to get started with your repair or replacements. Get Started Now Have A Question? Send us a message and someone from our team will reach out to you. Contact Us HVAC Maintenance Extend the lifespan of your system by joining the HVAC Maintenance Agreement! Join The Club Heating & Air Conditioning in Van Nuys, CA Over 60 Years of Quality Heating and Cooling Services For over 60 years, Kahn Air Conditioning has been the Van Nuys HVAC company that homeowners and business owners in California’s San Fernando Valley turn to first for reliable heating and cooling services. Our NATE-certified technicians can repair, install, and maintain every heating and cooling system make and model. Whether your air conditioning is on the fritz or your gas furnace breaks down and you need a furnace repair in the middle of the winter, you can rely on us to make things right. Our fees are competitive, and we have a great reputation within the community for our top-quality work. We serve Northridge, Encino , Woodland Hills , and adjacent communities throughout the San Fernando Valley area . We offer financing options on approved credit for heating and AC installations . We also specialize in Carrier products, and our team can service all makes and models. Between 1998 and 2006, we were honored as Northridge’s Carrier Distinguished Dealer, and we won the Carrier President’s Award in 2007, 2009, and between 2011 and 2015. Request Service Please fill out the form below to request an estimate or schedule service. "" * "" indicates required fields Name This field is for validation purposes and should be left unchanged. Full Name * Email Address * Phone Number * How Can We Help? * By clicking “Send Message”, I am providing express written consent to receive autodialed and pre-recorded calls, texts, and SMS/MMS with marketing communications from Kahn Air Conditioning regarding home services at the phone number provided above, even if the number is on a corporate, state, or national Do Not Call list. Consent is not a condition to purchase services or products. Our Services Comprehensive Air Conditioning Services in Van Nuys, CA Our team of professional heating and air conditioning specialists are here for you. From AC repair & AC replacement to new system installation, we’ve got you covered. Air Conditioning AC Repair AC Replacement AC Maintenance Heating Heater Repair Heater Replacement Heater Maintenance Call (818) 886-2600 or Schedule Service Reliable Heating and Cooling Services in Van Nuys, Los Angeles At Kahn Air Conditioning, our menu of services is designed to help you get a good return on the sizable investment you made in your heating and cooling system when you first purchased it. We’re a family-owned and operated business serv HVAC Service in the Valley | Kahn Air Conditioning Skip to main content Emergency Service Available! Call 818-886-2600 ABOUT LOCATIONS TESTIMONIALS CONTACT Service Area Serving Southern California since 1961 24-Hour Emergency Service Available Award-Winning Service Schedule Service Proudly Serving Van Nuys, CA & The San Fernando Valley Acton Agoura Hills Altadena Beverly Hills Brandeis Burbank Calabasas Canoga Park Canyon Country Castaic Chatsworth Culver City Dodgertown El Segundo Encino Fillmore Glendale Granada Hills Inglewood La Canada Flintridge La Crescenta Los Angeles Malibu Marina Del Rey Mission Hills Montrose Moorpark Newbury Park Newhall North Hills North Hollywood Northridge Oak Park Pacific Palisades Pacoima Panorama City Pasadena Piru Playa Del Rey Playa Vista Porter Ranch Reseda San Fernando Santa Clarita Santa Monica Sherman Oaks Simi Valley South Pasadena Stevenson Ranch Studio City Sun Valley Sunland Sylmar Tarzana Thousand Oaks Toluca Lake Topanga Tujunga Universal City Valencia Valley Village Van Nuys Venice Verdugo City West Hills West Hollywood Westlake Village Winnetka Woodland Hills Heating & Air Conditioning Company in Van Nuys CA Skip to main content Emergency Service Available! Call 818-886-2600 ABOUT LOCATIONS TESTIMONIALS CONTACT Van Nuys Serving Southern California for 60+ years 24-Hour Emergency Service Available Award-Winning Service Schedule Service Request Service Please fill out the form below to request an estimate or schedule service. "" * "" indicates required fields LinkedIn This field is for validation purposes and should be left unchanged. Full Name * Email Address * Phone Number * How Can We Help? * By clicking “Send Message”, I am providing express written consent to receive autodialed and pre-recorded calls, texts, and SMS/MMS with marketing communications from Kahn Air Conditioning regarding home services at the phone number provided above, even if the number is on a corporate, state, or national Do Not Call list. Consent is not a condition to purchase services or products. Heating & Air Conditioning Company in Van Nuys, CA Contact Kahn Air Conditioning today for reliable, award-winning heating and air conditioning service in Van Nuys, CA. Call (818) 886-2600 today! When your heating or cooling system fails, you need a reliable air conditioning company in Van Nuys, CA, that understands the unique climate challenges of the San Fernando Valley . Summer temperatures regularly soar above 90 degrees, while winter nights can drop into the 40s, making dependable climate control essential for your comfort. Kahn Air Conditioning has served Southern California for over 60 years, providing comprehensive heating and cooling solutions to homeowners throughout Van Nuys, from the Government Center area to neighborhoods near Van Nuys Airport. Read some of our 1,000+ positive reviews from residents throughout Southern California to see why our customers consistently choose us for reliable service and exceptional results. Air Conditioning Services for San Fernando Valley Residents As the leading air conditioning company in Van Nuys, CA , we provide complete heating and cooling solutions designed specifically for San Fernando Valley homes. Our NATE-certified technicians understand the unique demands placed on HVAC systems in this climate. Whether you live near the historic Van Nuys City Hall or in residential areas surrounding Woodley Park, we deliver prompt, professional service that keeps your home comfortable year-round. Our comprehensive Van Nuys AC repair services address common issues that affect local homeowners. We handle everything from refrigerant leaks and compressor failures to thermostat malfunctions and electrical problems. When your air conditioning service needs extend beyond repairs, we provide expert installations using high-quality equipment designed to withstand Southern California’s demanding climate conditions. Energy-Efficient Air Conditioning Installation & Replacement Our furnace and AC installation experts bring decades of experience to every project in Van Nuys. We carefully assess your home’s air "
Wally Falke's Air Conditioning,https://www.wallyfalkes.com/,1,"Client Challenge JavaScript is disabled in your browser. Please enable JavaScript to proceed. A required part of this site couldn’t load. This may be due to a browser extension, network issues, or browser settings. Please check your connection, disable any ad blockers, or try using a different browser."
Metrex Valve,https://www.metrexvalve.com/,1,"Metrex Valves | Water Regulating Valves | R410a HVAC | Marine Valves Set and Forget Reliabilty American Made HVAC Water Regulating Valves Get Answers Applications High Pressure Regulating Valves for HVAC Commercial HVAC Engineered Solutions US Navy Qualified Nuclear Power HVAC Commercial Marine Small Refrigeration Industrial Process Standard HVAC Water Regulating Valves 810-200-FL Standard Water Pressure, Standard Refrigerant Flange Ends – 2-Way K-810-200 Part Kit K-810-200 WCME-4075-3W High Water Pressure, Standard Refrigerant UNION ENDS-3-WAY REFRIGERANT PRESSURE ACTUATED 840P-37-SE Standard Water Pressure, High Refrigerant 2-WAY NPT ENDS WCMEHR-4075-3W High Water Pressure, High Refrigerant 3-WAY UNION ENDS (NPT) 800P-37-SE Standard Water Pressure, Standard Refrigerant Threaded Ends – 2-Way Shop Now Learn About Metrex Valve Specialized custom water regulating valves With the Widest variety of HVAC water regulating valves Metrex Pressure Actuator Valves provide the most design flexibility in air conditioning for commercial or industrial buildings. Applications include multi-story high-rise facilities, requiring high water pressure service, leased space and computer or telecommunication rooms. Designed to maintain peak operating efficiency Metrex Valve products will save energy, money and optimize capital equipment life. READ MORE Desalination Plants Water stress is a global problem. As noted by the Council for Foreign Relations, a shortage of drinking water is often not a matter of actual scarcity of water, but a lack of essential infrastructure like storage and sanitation facilities. However, in certain regions of the world such as the Middle East, North Africa, and the southwestern United States, physical water scarcity is a problem demanding creative solutions READ MORE Nuclear HVAC Valves Reliable design is job one in the Nuclear Power industry. Metrex Valve has highly developed design and test capabilities, to ensure a solution that works. Metrex Pressure Actuator Valves are ideal for both raw water and closed loop treated water. For over 40 years Metrex Valve has provided custom cooling valves and flow control valves to the nuclear industry. READ MORE Case Study Case Study Coming Soon Case Study Coming Soon Read More Case Study Coming Soon Case Study Coming Soon Read More View All Blog Increased Government Funding Needed for Navy’s 2025 Shipbuilding Plan April 07, 2025 Tariffs and Price Fluctuations For Commercial Grade HVAC Water Regulating Valves March 20, 2025 Development of Desalination Plants Increasing Around the World to Fight Water Scarcity January 03, 2025 Long-Range Shipbuilding Strategy for the U.S. Navy October 17, 2024 Best Marine Valves – DOD-Approved Contractor July 11, 2024 View All Where Do We Fit in the Process READ MORE Valve Rebuild Kits READ MORE Metrex Valve delivers a completely self-contained, self-powered and self-regulating valve solution that saves energy and money. Call Today 800-266-4027 Contact Us"
